filename,Language,text_english
00030.wav,English,"In 1920, I traveled to Chicago for a work meeting. It was my first time visiting the United States. And I felt both excited and be scared. The flight was long, but I enjoyed looking out of the window and thinking about adventure ahead. When I I landed at Ohio airports, I took a taxi to my hotel, the tall buildings and the and the bus and the busy street made me feel like uh I had started into a movie on my second evening, I went for a walking along the Chicago river, walk. The lights from the tile buildings reflected on water. And it looked magic, magical. And as I was walking, I noticed a smell, Italian restaurants that didn't seem very busy. I feel so curious, I decided to go into and have dinner there. The food was delicious and the place felt very crazy. While I was eating, I saw an old man sitting alone at a table near the window. He was catching something in a notebook. I couldn't help but ask him about it. He smiled warmly and invited me to join him. He told me he used to be a a check, are cherished and had worked on some Chicago's famous building, like the wealth tower. He showed me some of his sketches, uh, which were amazing and shared stories about his life in the city. I ended up spare a spending hours taking to him, learning about czechos, history and his table when he made my trip so much more special. Although I didn't have time to explore everything in the city, the memories start with me. I hope I can return to Czech one day to create more memories like this."
00031.wav,English,"In 2018, I finally had the chance to visit Tokyo, Japan, a city I had dreamed of exploring for years. It was a week long trip and every day was filled with excitement and new experiences. From the moment I landed, I was amazed by how clean and orderly everything was. The trees were bustling with people. Yet there was a sense of calm and that made the field city feel so unique. On my first day, I visited shibu, ya crossing the world's busiest pedestrian intersection. It was incredible to seeing hundreds of people crossing the street from every direction at once. Yet everything moves so smoothly. I stood there for a while, just taking it all in and then joined the crowd to cross the street myself. We felt like I was part of a smooth movie scene. Uh, later I wandered through the nearby series filled my with the shops and restaurants and try some delicious street food, including takuyaki and flavor ice cream. Uh, the highlight of my trip is was visiting the ghibli museum in me, taka, as a fan of Stewart gibby films, like break it away and my neighbors also, it felt like spike stepping into the magical world. The museum was full of musical exhibits, like a life size catapults and favor a beautiful hand drawing sketches from the movies. There was even a small theater where I watched, I watched a short animated film, title exclusive to the museum. It was an unforgettable experience that made me appreciate the creativity behind those moves movies even more. One day, I took a train to asa Cosa to visit senso ji temple, one of the Tokyo's oldest and uh most famous temples. The main gate were the main gate with its giant red lantern was so impressive. I walked through the not come as a shopping street, lined with small shops, selling souvenirs and traditional snacks. I bought a little charm for good luck and try some freshly make. Thai yucky, a fish shaped cake filled with sweet red bean paste. Tokyo was everything I had hoped for and more the mix of modern sky crackers and traditional temples, the delicious food and the pride and friendly people made it a city like no other. When I left, I feel a little sad, but I knew I would come back one day to explore even more of what Tokyo had to offer."
00032.wav,English,"Last spring. I got a chance to visit Tokyo, Japan during the Cherry blossom season. I had always wanted to see the Cherry blossom. And it was even better than I imagined. I want to talk to you do a short break between senators just in turn, Florida long seems to be as their best when I stabbed out of the train station. I saw Cherry trees everywhere on the streets, in the parks and the lonely rivers. On the first day, I went to philosophers pass. It is a stone pass next to a small kernels. Cannot. Canada and both sides are lined with Cherry trees. The cosmos were in full blown, and some of the petals were falling into the water, making it looking. I walked slowly along the path, enjoying the view. There were many people there, some told me taking pictures, some just sitting under the trees, and even though it was crowded. Ok. It felt very peaceful. Everyone seemed happy just to be there. Enjoying the flowers. In the evening, I went to the another park. These had lit up the Cherry trees. And it looked magical. The biggest trees in the park was full of pale pink flowers and it's nice, made it same. Seem like something out of a dream. Many people were there. Something on rankings under walking slowly under the trees. And I walked under the growing blown sums are feeling like it was in a different world."
00033.wav,English,"Last year, I want I went on a tribe to the Singapore. I was excited to explore the city and the stars, things. My first stop was the famous center in Chinatown. Will I transfer variety of local dishes? I have the best, both of which incredible favorite, favorable and satisfying government to delivery with people from all works of life and enjoying their meals. I felt a sense of excitement and happiness following the unique tests is a and energy of police. Next day, I want a visit another city and known for AIDS, flower dome. Walking through the gardens. I was I missed by the design at the variety of plants. I felt a deep happy for the beauty and in our nation of the urban plants. Later, I meet local graduate who showed me around the neighborhoods of Singapore. He sharing stories about the city's past. And is. Thank you. Developments. I feel the marks of admission learning about the rich, cultural heritage and modern achievements. The the trip to Singapore was a wonderful blend of life designs and cultural exploration. And I left with many memories and happy of the world."
00034.wav,English,"Last year, I planned a trip to Paris to attend the opening of a renowned art gallery showcasing the work of my favorite artist. This was a once in a lifetime opportunity, and I had been preparing for months. I had carefully saved up, purchased tickets well in advance and planned every detail of the journey, the gallery was scheduled. You open on a Saturday evening and my flight was set for Friday morning to ensure I had plenty of time. On the day of the flight, everything started to go wrong. I woke up later than planned because I had stayed up packing the night before. I rushed through my morning routine, keeping breakfast, keeping breakfast and hurriedly called a taxi to the airport. Driver tried to navigate the morning traffic, but it seemed every road was congested. I nervously checked my watch every few minutes. My heart seeking as the minutes, take it by by the time we reached the airport, I had only 20 minutes left before take off. I sprinted to the checking counter only to be told that the gate had closed. And my flight had already begun boarding. I stood there in disbelief, watching the departure board as my flight status changed to departed. Disappointment was overwhelming. I had looked forward to this event for so long. Imagine myself walking through the gallery, surrounded by the works of an artist who had inspired me deeply. Missing the flight felt like I had LED the dream, slipped through my fingers, emotions tied, so tied to such an experience, makes me appreciate the importance of preparation and timing. It's a reminder to never take opportunities for granted."
00035.wav,Chinese,"Oh, I remember it was the summer vacation of 2023. Oh, I'm in my sophomore year, and my younger brother just finished the college entrance examination. So I plan to go to Fuzhou to visit him for a while. Because of the college entrance examination, I didn't refuse during the winter vacation and Chinese New Year because he has to review his exam subjects and prepare for the exam. So we can't disturb him either. Looking at it now, he did get a pretty good score in the college entrance examination. He was studying physics at Shanghai Jiao Tong University, and it was only during that summer vacation that he missed him very much. After all, it's been too long since we last met. When I went to his place to play, I played all the games that I didn't play in high school, such as League of Legends and Fearless Contract. We played games together in a double row and found them very interesting. Besides playing games, we will also go out and find some local specialties. I have checked everything about the famous Fish King Meat Banquet in Fuzhou, as well as things like aged noodles and noodles. Fuzhou's cuisine is also very interesting, but one of the more famous ones is called San Gang, which has a lot of snacks and local souvenirs. But my brother and I are both locals, so Yeah. Find some delicious food. And after playing for a while, I felt particularly happy. Ah, then we chat every night at one or two o'clock, chatting until one or two o'clock before going to bed. And now he is also studying in college, and I am also studying in college. Every time we meet, we only have to wait for some winter or summer vacation time, so I think that time was particularly happy."
00036.wav,English,"My sorry. Well, I will tell a story that happened recently. Just a week before I went to Tianjin, uh, to which is my best friend, which we have, which we have uh know each other since the since nearly 10 years ago, Tianjin, you know, is a very good city and is very famous for his the for the breakfast first uh culture of him. So I so, uh I'm very happy when I launched. I launched Tianjin at the first time because my friend come to uh take me, you know, probably take me. And so then we go to the uh the very famous place of Tianjin, the Tianjin eyes, just like the London eyes. Uh um II would say I feel a bit a little bit disappointed when I asked. I see the Tianjin eyes because it's far more smaller than the London eyes. And then, you know, it's not really shock when I see it on and on the internet. Uh, but then a I taste some very a very, very delicious, Tianjin. Breakfast. And like the du Jiang and something else is very delicious and I can make my mood feels better. E and and then my friend take me to his university university, uh, as you know, the the college student will always do that, take their a friend to their core university when I see their university is big, large and good. Um I speaking I don't feel something about that because it is they just AA normal university. I don't feel uh very if II don't feel uh uh it's very good or something. And we and then I have to go back to home because I just get get to uh holidays and one day we have and we have spent one day, so I have to go back to Beijing. When we left, I feel a bit a little bit disappointed and a little bit sad, because we have never we have we haven't met a long time before, and we just met nearly 1.5 day this time. But I do believe we can have more time to stay in the future. And when I see this story now, actually I don't feel the bad mood. I just feel happy. This is a very happy memory."
00037.wav,English,"And this is my story. A few years ago, my sister and I went to Hong Kong. And one of the highlights of our trip was visiting LAN kuifeng. A popular bar district district. It was our first time there. And we were excited to experience the vibrant nightlife that we had heart heard so much about. The narrow streets were filled with people. And the energy was electric music blurred from all directions and love. Yeah. Love for. And latter, he coached down the Alice. They that night, there was some kind of event were where people dressed up as different characters. We saw superheroes, cartoon signature, car cartoon figures, and even some historical characteristic characters walking around it felt like we were in a movie. We found a bar that uh, looked interesting and went in. The atmosphere was lively with people dancing, singing along to popular songs, and just having a good night. My sister and I ordered some drinks and drowned in the farm. We danced last and even made a few new friends who were also visited from other places."
00038.wav,Chinese,"Well, a few classmates and I drove to Changbai Mountain by road in the summer of 2017, so the journey was quite long. The scenery along the way was intertwined and varied, with trees, railways, grasslands, and occasionally a few small rivers. We talked and laughed along the way, so the journey was not particularly boring. The first thing we did when we arrived in Jilin Province was to taste the local iron pot stew. Although iron pot stew is more enjoyable to eat in winter, we still had to take a bite even after going there. In the summer, we were sweating profusely due to the stuffiness. The carefully prepared sauce and various side dishes were boiled and wrapped in a large pancake, and we still couldn't stop thinking about the rice. Later, we went to Changbai Mountain again because the cool weather there allowed us to briefly escape from Beijing's steam ovens. The scenery was beautiful, with lush forests and fresh air. We wandered between clouds and mist, feeling like we were in a fairyland. Then there were a few eagles hovering and flying over the mountain spring on the side, as if they had received a hug from nature. Afterwards, we went to Northeast barbecue, where grilled skewers were a major specialty. It is said that there are no Northeasterners who can't barbecue skewers. The meat and dishes are very sincere, and the fire control is just right. Unlike the thin and hard skewers made by street vendors, the skewers we ate can be described as fresh, fragrant, and delicious, with alternating fat and thin, steaming hot, and making a slight sizzling sound. I still drool when I think about it now. Then we also tried several local specialty dishes, such as the Three Fresh Pot Pork and the Slippery Pork Section. Although these dishes can be found in takeout from various places, we can only taste the most authentic flavor in Northeast China. When stir fried on the table, you can still bring out enamel coated pork belly, which looks like a dark plate of ground three fresh dishes. However, each dish is coated with a sauce that has been thickened, making it a perfect complement to the meal. The prices of the dishes there are relatively cheap, and there is no shortage of food. The bosses are very enthusiastic, and during the waiting period, they even give us homemade pickled vegetables or appetizers, and chat with us about our daily lives. In our communication with the boss, even our accents have become a bit Northeastern, indicating that Northeastern has a greater impact on people's accents. This trip was a journey of playfulness and relaxation while standing on Changbai Mountain, as well as the ultimate enjoyment brought by authentic Northeastern cuisine. It can be considered a journey of enjoyment or healing."
00039.wav,Chinese,"Well, I remember in the summer of 2023, I invited my family and I to come and play in Beijing because I am studying at Beijing University of Posts and Telecommunications. Well, what's different about this trip is that in the past, Beijing wasn't considered my hometown because I had to take the high-speed train every time to get here. But this time, what's different is that I'm studying here, so I don't need to take the high-speed train. We played for about a week. At first, we planned to join a group tour, but after thinking about it, we decided to choose a customized tour called Ctrip because we took care of many elderly people and children in the team. I remember it cost several tens of thousands of yuan to charter a car, which was quite expensive. However, the experience was not that good because some bad things happened during the group tour. For example, due to some traffic restrictions and vehicles, the car we booked couldn't arrive at our place in time. Also, the driver may have been a bit lazy and didn't want to pick us up. So although he gave him money, he didn't give it to us. We worked diligently, and in the end, Ctrip also provided us with some compensation. Well, you're asking me if I'm happy driving, right? Well, it's just so so, because although he compensated me, I still felt a little weak. Finally, we went to many places, including Peking University, the Great Wall, the Forbidden City, and many other places. Then I found that many places were not very good at grabbing tickets. I had to work hard to grab tickets. The place that impressed me most was Universal Studios. Well, Universal Studios was very interesting. There were many unique movie characters of Zhan Huan, and some other things in it. It was very interesting. Uh huh. Um, I remember on the last day, we went to the Forbidden City. Actually, I didn't think it was suitable to go there on the last day, but it was still the last day because you know it's difficult to grab tickets. So on the last day when I went to the Forbidden City, I remember there were still people wearing the emperor's clothes going in to take photos. I think this idea is quite novel. Uh huh. Overall, it was a pretty good trip, but there were also some bad things. Because you know Ctrip's drivers are a bit lazy, so this is my story."
00040.wav,English,"Back in 2020. I one to visit my a high school classmate ggr he was in Zhejiang University, so I124000 to visit him. We plan men, uh, we plan to visit West Lake together to for you to see the beautiful landscape. But because of an accident, the plan cancelled. My friend, DJ. Make his like her, heard it. Just the day it just yesterday before I went to Hangzhou. So we finally went to see a movie. It was a very happy time with him, because he was one of my best friends. So no matter what we do, we still have a good time. After that, we went to a restaurant to taste some famous dishes in Hangzhou. I can still remember many dishes. For example, like sisi Hu Hu tu. And beyond sunshine. Don't parole. And so on. That was very delicious. Until today, I still can't forget the flavor. I enjoy a very good time in Hangzhou, and I can't wait the next time. I the next time I went to Hangzhou, how can experience more interesting things there again."
00041.wav,English,"I met my girlfriend when we signed up in the same group for the first time. She was pretty but silent uh, in order to talk about how to do our work later, we exchanged our wechat IDs. After all, the works were done. I asked her to come out and hang around one day. I was excited when I sent that message. Even she said, yes, I still cannot believe that was real. Also, I was very nervous, because that was my first time walk around with a girl. We went around the school for a long time, and talked about a lot of things from study to dreaming future and so on. At the end of the day, I was so glad to hear that. She said she likes going around with me and expects the next time we come out and chat with each other. After our few times, hang out. I bought flowers for her and gave her. When she did not even know it. She was surprised. And then I declared my love for her. I asked whether she would like to be my girlfriend. And she said, yes. And until now, we had became together for almost650 days. Yes, that was a quite long time, but I think the time we became together will be longer, longer, and longer."
00042.wav,Chinese,"Ah, that was a day full of anticipation. Ah, I finally went to the United States to participate in an NBA game in person. Not only that, but I also got a chance to meet basketball superstar LeBron James. It all sounded like a dream, but when I stood in front of the Staples Center in Los Angeles, I couldn't believe my eyes. I have always been a loyal fan of James. Since the season he first entered the league, I have been following his games and witnessing his glorious journey from Cleveland to Miami, back to Cleveland, and finally joining the Los Angeles Lakers to win multiple championships. Being able to see him with my own eyes and even communicate with him face-to-face is an unparalleled honor for me. I arrived at the game venue early that day, and the atmosphere was filled with excitement and tension. The Lakers were about to face the Warriors, and fans gathered outside the door excitedly discussing game predictions and player performances. Finally, the staff took me into an area specially prepared for the media and VIP guests, where I could observe the team's preparation process up close. As I walked into the hallway of the players' locker room, I suddenly heard heavy footsteps. I turned around and saw the basketball superstar LeBron James, whom I had admired since childhood. He was wearing a Lakers training uniform and holding a bottle of water in his hand, walking towards the training ground. Although he looked very focused, when he saw me, he smiled slightly and seemed to be familiar with me. We started discussing basketball and also talked about his personal life. He told me that besides the challenges of the basketball court, family and social responsibility are the most important parts of his life. He mentioned that as an athlete, he sometimes faces tremendous pressure, but he always believes that with the support and unremitting efforts of the team, all difficulties can be overcome. I asked him, during your long career, when did you feel the most proud? James and Chen Slupanik smiled slightly and answered, 'My greatest pride is being able to bring back that championship trophy for my hometown Cleveland. It was the result of our team's hard work and the most unforgettable moment of my career.'. Winning the championship is not just for myself, but for the fans and people in my hometown who have always supported me. In just a short conversation, James left a deep impression on me. His humility and focus, as well as his love for basketball, far exceeded what I knew of him. He is not only a superstar on the court, but also full of water management and human touch off the court. When I said goodbye to her, I felt an indescribable sense of satisfaction. Being able to communicate face-to-face with great athletes like James was one of the most precious experiences of my life. Although I know that people like James may only meet once in their lives, his focused and passionate spirit will always inspire me to constantly pursue my dreams. The game began, and I sat on the sidelines, my eyes fixed on every moment on the ball. James' performance on the court was as stunning as usual, and in that moment off the court, his sincerity and humility deeply touched me. That's all thank you。"
00043.wav,English,"I went to a life house. Several weeks ago. And for meeting my, I know, sea. And that was the first time for and two SARS, a long horse in ak. So I cherished that opportunity and bought my ticket instantly. Am ni finally, right there, I saw a lot of sounds just like me. Ok. Day, they send as many little gifts for Free. And that was really are really happy for me. Uh, however. Hello. Cause of there are too many people. So I get going to the house. My place is a little bit far from the stage. But it doesn't affect my passion of listening to the beautiful, amazing music. What is more fantastic is I were selected as the lucky one to go onto the stage and take a shower with my head over this. I was really excited that time. And II couldn't certainly describe to more Dita. Ours is just so happy."
00044.wav,Chinese,"In 2012, I went to Xizang. When I landed in Lhasa, I was immediately attracted by the magnificent natural landscape there. On the first day, I visited the Potala Palace, which was magnificent and magnificent, leaving a deep impression on me. I also saw many Tibetan people wearing traditional costumes, and they were all very friendly. I listened to the guide's explanation in Potala Palace and learned about the history and religion of Xizang. In the afternoon, I went to Jokhang Temple, where there were many ancient Buddha statues and murals. I felt a deep sense of tranquility and awe, as if I were in another world. The next day, I went to Namtso Lake, where the water was very clear and surrounded by towering snow capped mountains. I took a walk by the lake, enjoying the fresh air and peaceful environment. I also rented a small boat and rowed to the center of the lake. The underwater scenery is very beautiful, and I can clearly see the fish and plants in the water. That evening, I stayed at a small hotel by the lake. The hotel owner told me that local monks would hold some special ceremonies here. I decided to attend the next day. On the third day, I went on a hiking trip, crossing the grasslands and rivers on the plateau. The scenery of the plateau was very spectacular, and I saw many wild animals, such as Tibetan antelopes and Tibetan wild donkeys. This trip made me feel relaxed and had a huge impact on my personal growth. Every time I think back on this trip, I feel very happy and grateful."
