filename,Language,text_english
00073.wav,English,"As the autumn leaves begin to turn golden and crisp. I found myself filled with a sudden urge to revisit my past. It has had been years since I had graduated from elementary school. But the memories of my teacher and classmates. Still, Leonard warmly in my heart, among them, missis dong. My first grade teacher held a special place. She was not just a teacher. She was a monitor, a Guide and a friend, her patience and kindness had natured my love for learning and shaped my character with each passing day in college. I realized more and more how much she had influenced me. One sunny afternoon, I decided to take a trip back to my old elementary school. The familiar gaze and playground greeted me with a sense of North Korea. Walking down the corridor, I could almost hear the echoes of my childhood laughter, and the sound of me stones, gentle voice, Guiding us through lessons. When I reached her classroom, I hesitate for a moment, wondering if she would remember me, taking a deep breath and knocked on the door to my delight. Miss stone's face lead up with recognition and warmth as she opened it. Oh, it's you she exclaimed. Her eyes twinkling. Was try. How hard? Vubnimimim was sat down in the classroom, surrounded by the same desk and chairs that had once held our young for dreams. Missus dong asked me about my college life, my major and my future plans. I shared with her of my experience, my achievements and even my struggles. She listened intently, offering words of wisdom and encouragement as always. As we talked, I noticed how little she has had changed. His smile was still as bright. Her eyes still as kind. And her passion for teaching still as burning. It was as if time has stood still in her classroom, preserving the warmth and love that she had always gave us. Before I left missis dong hands, handle handed me a small book, filled with notes and messages she had written for me. This is for you, she says softly. Remember, no matter where you are go, or where you do, always stay true to yourself and keep push through in your dreams. Well, it's really impressed me a lot. And that's my, sorry."
00074.wav,English,"Last summer, I visited my cousin who lives near the beach. It was one of the best vacations I have ever had. My cousin's house is in a small town by the sea, very quiet and peaceful. When I arrived, the first thing I noticed was the fresh sea and the sounds of the waves, my cousin was waiting for me and we spent the afternoon catching up. The horse was cozy with lots of plan, plants and big windows, where you could see the ooo. Every morning I woke up early and wake up and walk along the beach at that time. The beach was almost empty and it feels like it was just for us. The sand was cool under our feet and the waves touched our tones as we walked. Sometimes we would pick up seashells and I loved seeing the different colors and shapes. It was such a simple thing to do, but I made me feel really happy and relaxed one day. We returned to small boat and went out to sea. My cousin knew how to say, and I just enjoy sitting here, washing the water and feeling the wind, sadly. So dolphins, there were a few of them seeming not far from our boat. They jumped out of the water and I had never seen dolphins in real life before and it was amazing to see them up close. It feels like something you only see on TV but it was happening right in front of us."
00075.wav,Chinese,"I went back to my hometown and on the first day, we visited an old man's house. During our conversation, we learned that the old man's calligraphy was particularly good. As soon as I heard this news, I became very interested. The master saw how interested I was and enthusiastically led me to visit his study. As soon as I entered, I saw many beautiful and magnificent handwriting hanging on the wall. I was so surprised that I opened my mouth wide and couldn't help but sigh. I also wanted to write such beautiful words. The master immediately took out a piece of rice paper and started writing. I saw his momentum like a rainbow, his writing was very decisive, and he had perseverance. After laughing a few times, he wrote a few words. Upon closer inspection, I noticed the words' Endless Learning 'written on the paper. At this moment, my grandfather spoke earnestly to me,' Learning is endless on a child's life journey. You should always maintain a humble and eager to learn attitude in all aspects of life, including acquiring knowledge, improving personal cultivation, and so on. You should not be arrogant or complacent, but continue to pursue more knowledge and higher realms. It is our way of writing, just like how I write calligraphy. '. Every day when I write an extra painting, it brings me an extra sense of connection, and there will always be new things waiting for you to learn and discover. Uh huh. I can write such excellent fonts now without my daily learning. Even now, I am still constantly learning and improving. Speak up, the old man gave me that word, which deeply touched me and made me determined to study hard and make progress every day."
00076.wav,English,"I went to Iceland with a few friends. It was a trip. We had been planning since the beginning of the school year. And we were all so excited to finally experience the natural beauty of the unique country. We landed in a we landed it earlier in the morning and even from the plane, I could already see the incredible lines with mountains. And endless fields of rocks covered in moss. On our second day, he drove out to a place called a national park. The driver was please take him. There were stretches of empty roads means nothing but nature around us. We even stopped it as the few place to take pictures of the waterfalls and mountains in the distance. Once we reached reach there, I was struck by how worse and open it was. The park is where the NASA place of North America. And you are some meat. And it felt uh, specialist beers standing be too into consist. We spent the day hiking along the trails, talking in the beauty views of the lakes and rivers. At one point, we come across a small palace that legs were hidden in waterfall. The water was crystal clear and it was cool filled who missed our face, and at least to the nearby. It was so peaceful. There was no one else. Run tries the sound of water falling and opposite. Tripping off. Whereas my friends and I sat here for a while, just enjoying the quiet beauty of the place. I remember thinking how rare it was to find such a perfect sport. Your arms, you seemed untouchable by time."
00077.wav,English,"In may of this year, I went to a concert of my favorite idol. It was the first time I traveled alone to a foreign country, just for a long awaited appointment. The decision was made in a hurry. I made up my mind only a month or so. Before the concert. And I had to prepare all the things for going abroad by myself. It was a stressful and anxiety ridden process, but happiness I had been waiting for sustain me through it all at concert. I met my idol who i've loved for a long time, shining brightly on the stage and fans who love them as much as I do, waving their sports sticks and singing along with them. At this concert, I heard one of my favorite songs which inspired me when I was lost for the smile, the brown with tears. The moment is the face again. Let's go now. When I was at concert, the vivid vitality of my favorite idols standing on the stage was contagious to me. I came running across the obstacles. And the moment I saw them all the hard work during the preparation this separated, living only happiness. I don't regret this trip brought along, because the brave enjoy the world first."
00078.wav,Chinese,"Last autumn during the National Day holiday, I went to Hangzhou to interview a friend I hadn't seen in many years. This trip was very special for me because Hangzhou is a place I've always wanted to go to but haven't. And this friend from Hangzhou is my high school classmate. Since we started college, we have been busy on our own and haven't seen each other again. That morning, I sat out of the high-speed train window in Hangzhou and the scenery gradually changed from the bustling city to green mountains and waters. Along the way, I was full of anticipation. When I arrived in Hangzhou, my friend picked me up at the station. At the moment we met, we both smiled, as if we were back in high school. He took me to the old street he recommended, which is a very quiet pedestrian street lined with old houses and small shops. He said it preserves his memories of two years in college and is one of his favorite places. We first sat down on the street and drank a bowl of hot osmanthus lotus root powder, which had a faint sweetness and osmanthus aroma, and then felt a warmth of home. I slowly walked on the old street and looked at the small stalls selling handicrafts. My friend told me a story about what happened during his two-year stay here during the reign of Emperor Yu. He said he didn't always come when he was sad or happy. This pedestrian street is for relaxing and leisure activities. I looked at his smile as if I could see what he looked like on this street at the time. In the afternoon, we went to West Lake, and the willows by the lake had already turned slightly yellow. The lake was shimmering with golden light in the sunlight. We rented a small boat and slid slowly to the center of the lake, where the wind was light and cool. It seemed like we had talked a lot about his college life, his hobbies, and his plans for the future. We also talked about the bits and pieces of high school days when we stayed up late to memorize manuscripts and went out to play together. Time passed quickly, as the sunset gradually set and the lake was dyed orange red. That night, we had dinner at a small restaurant by the lake. Although it was just a home cooked meal, it was particularly delicious without the company of old friends. After dinner, we took a walk by the lake, watching the distant lights reflecting on the surface of the lake, like countless stars scattered in the water. I took a deep breath and felt that the tranquility and beauty of this moment would forever remain in my memory."
00079.wav,English,"I travel to Europe with my family this summer, leaving behind many heartwarming stories in the process. One night in Munich, my family and I had drinks at royal court. Be a horse. Because of the brewery reputation, guests from all over the world enjoyed drinking at the tables. It was the first time I drank a little of beer in one night. And because I was spending time with my family, I just felt warm and happy. We enjoyed the local specialties of Munich, such as pop knuckles and white sausages. There were not only guests, but also to local musicians. And the atmosphere was very happy. I was chatting with my family about family matters. But suddenly, a familiar music came to my ears. And that is the classic Chinese song. The moon represents my heart. I was so excited to hear the so called hometown sound in a foreign country after my family. And I quietly enjoyed the song. We know that it was ordered by some colleagues who were having a party at another table. We raised our glasses in the air and offered each other good wishes. It was a warm and human moment that I will never forget."
00080.wav,Chinese,"Last year, I heard about a hidden village in Sichuan, which is rarely visited by tourists and is completely surrounded by mountains. Driven by curiosity, I made up my mind to explore with my friends. When we arrived at the village, it was already evening. The village was located deep in a dense bamboo forest, and the houses were made of wood and green bricks, looking like relics preserved from ancient times. The village used very little electricity, and every household relied mainly on oil lamps for lighting. The villagers are often very curious about foreign tourists, but they are all very friendly. Several villagers invited me to their homes for a meal and rest. After dinner, the old man began to tell a legend about a village that was once the habitat of a hermit. He had a magical ability to summon animals in the mountains with a bamboo flute. It is said that this kind of creaking sound can not only attract deer and birds, but also heal injured animals. I am very curious about this. Requesting the elderly to visit the assistant of the hermit. The old man took me to a small house behind the village, where there was indeed an ancient bamboo flute placed. I carefully picked up the flute and tried playing it. However, something unexpected happened when the sounds of birds and deer came from outside. The old man smiled and nodded, saying that this was the magic of this flute. Although I cannot fully believe in the authenticity of this legend, the experience of that night remains unforgettable to this day. That flute seems to hold some mysterious power and has become an eternal mystery in my heart."
00081.wav,English,"In counting worms. It was a freezing winter day. The wind was blowing, blowing like a knife across my face. I had just experienced a major setback at work. And my mood mood was extremely low. Walking on the deserted street, I didn't know where I should go. When I passed by a coffee shop, the warm light there seemed to have a in have an in its is play k boss attraction and I couldn't help, but walking the shop was filled with a rich aroma of coffee. And so, smoothie music was flowing in the air. I found a corner and sat down, ordering, ordering a cup of coffee, trying to calm myself down. Just then a girl come over. She has long black hair and bright eyes with a warm smile on her face. Hello, may I sit here? She pointed to the seat of seat. Oppo opposite me. It I was a bit surprised but still needed. After the girl sat down, we started chatting. Her voice was pretty gentle, and her was were full of love of life and a positive attitude. She shared with me her travel experiences, the good books she had read. And the interesting people she had met in her never never narration. I seem to see a colorful world, a world without troubles and setbacks, only endless beauty and hope. Before I knew it, I my mood, my mood had gradually improved. When we were about to leave the girl hand, handed me a piece of paper with a sentence right on it. There will always be tough times in life. But please believe that something wonderful is all is about to happen. I watched her walking away, and my heart was full of emotion. Since then, whenever I encountered difficulties and setbacks, II always think of think of that girl and her words. She is like one way warm Ray of sunlight. Ing illuminati in the past and ahead of me. In my darkest moments, this chance encounter has become an unforgettable experience in my life. It has made me us understand that even in the coldest winter, there will be warmth. As long we feel. And um, discover our hearts. There is beauty everywhere in life."
00082.wav,Chinese,"In the second half of my sophomore year, I visited my high school classmate in Xi'an, Shaanxi. He is studying civil engineering at Chang'an University. My civil engineering classmates in China are often ridiculed, and he is no exception. I often joke about his major. He planned to take me on a tour of Xi'an, but later our plan changed. We went to another city in Shaanxi Province, Baoji City, because we considered that there were too many people in Xi'an and holidays, so we went to other cities. And he was already tired of visiting Xi'an, so we unanimously decided to go to a new place, Baoji City. We bought station tickets back and forth from Xi'an to Baoji, mainly because the hard seats were sold out. Baoji is indeed an 18 tier small city, and hotels of the same specifications are several times more expensive in Beijing. When we arrived at the station, what we saw was desolation. We saw the roads and high-rise buildings under construction, and sure enough, the ride hailing services here were very inconvenient and difficult to book, but taxis were also too expensive. So we took the bus out to play, which was also run down. It was still very hot in summer, and we didn't even want to turn on the air conditioning inside the bus. The only place worth visiting was the Bronze Museum. When we arrived at the Bronze Museum, we were already very tired. Although the Bronze Museum looked particularly magnificent, we didn't have the energy to visit anymore. So we found a seat to rest for a while, and the mood to visit was gone. In the end, we took a quick look and the only thing that left the deepest impression on us was his tripod like appearance. Then we went back to the hotel. As soon as we arrived, we didn't want to go out and hadn't seen each other for a long time. So we stayed in the hotel for two days, playing games. We took a nap during the day, ordered takeout until noon, and played games until late at night. On this trip, we went to a bronze museum. Finally, when we left, we went to the bustling night market and wanted to eat some snacks to make up for our regret. However, the homogenization of snacks here was too severe and there was no distinctive feature. After a long wait for roasted pig trotters, the taste was mediocre and can only be described as tasteless. Minxin, who we have been waiting for a long time, has no taste without chili, but after adding chili, there is only a little bit of spiciness left. My own trip can only be described as a bit regretful, but I am also visiting my old friend. Anyway, it is acceptable."
00083.wav,English,"When I was in middle school, I went on a trip to Yunnan. It was supposed to be a very happy holiday. Um, but after we visited Shangri la and returned to Kunming, my younger brother suddenly developed an air infection. I really love the beautiful scenery of Yunnan, especially Shangri la. We spend the first 2 days in there, and we visited the national park, admire the clean water of lake. And I even try the local special food, sustainable. My brother and I both especially enjoy the horseback riding. And the instructor carefully selected gentle horses for us. However, when we finish our stay in Shangri la and return to Kunming, my brother began to feel severe pain in his ear. At first, we thought it was just a common ear disk uncomfort. But soon he developed fever and was in such pain that he held his air, even while sleeping at night, we quickly took him to the nearest hospital where the doctor diagnosed him with a cute t vs media, a requiring immediate treatment. Our parents were very worried, and after observing my brother's condition, on the day, without any significant improvement, we had to make a tough decision and to end the trip early and return home as soon as possible. Uh, under the doctor's guidance. Uh, and ah after applying several courses of ultimate, his condition gradually improved, although the trip didn't uh, end as perfectly as we hope. It made me realize that the health and happiness of my family are the most important thing."
00084.wav,English,"A story is the adventure at the old bookstore on a lazy, sunny afternoon. I was wandering aimlessly on the street. By accident, I turned into a rather out of the way alley that it was filled with an old smile. And as as if time had slowed down there, suddenly, an old basketball came an old bookstore came in too well. The bookstore was simple and messy with several yellow, the books placed randomly Jone ban in is is applicable. Erection. I walked closer to the bookstore and started rummage it through the books. A worn out old book with a damaged cover, caught my attention. Just as I picked up this book to examine if it carefully. And an old voice came from beside me. Young man, you like this book, too. I looked up and saw an old man with gray hair smiling at me. The old man was sitting on a small store beside with a loon in his eyes. That that was both profound and wise. We started chatting about this book, and the old man told the story behind it, which was a Legend about courage, perseverance, and dreams. I was completely captivated. As if I had, then has been taken into another world. As the chat went deeper, I discovered that the old man had a rich life experience. He used to be a brave adventure, having traveled, having traveled to many place where few people had been. He was also a scholar who loved reading and had profound insights into various kinds of knowledge. His stories gave me a new understanding and perception of life. Before I knew it, I it was already getting dark. I said goodbye to the old man and left the alley with a with that old work. And heart of a harvest. This this chance encounter was like a bright star in polluting, illuminating my ordinary life. Since then, whenever I see this, that old book, II always think of that afternoon. The older bookstore, full of stories and admirable old men. It has made me understand there are surprises and miracles everywhere in life. As long as we have a heart that is good at Discovery."
00085.wav,Chinese,"Last summer, I went to Hangzhou specifically for the beautiful scenery of West Lake. This was my first time going to Hangzhou, and I had only seen his appearance in books and movies before. On the day I arrived, it rained slightly, and the entire West Lake was shrouded in a thin mist, making it even more mysterious and poetic. Walking on the Su Causeway, along the winding path, one can occasionally see the willows on the shore gently swaying in the breeze, causing ripples on the water surface as if beckoning to me. Later, I rented a small hand rowed boat and slowly rowed towards the center of the lake. The boatman is an elderly man over sixty years old, and he happily told me the story of the White Snake with a smile on his face. When Xu Xian and Bai Niangzi met at the Broken Bridge, he pointed to the distant suspension bridge and sighed, 'Ah, it's there that the legend really makes people believe in love.'. At that moment, I felt like I had traveled back thousands of years to Jiangnan. At noon, I went to Louwailou to try authentic Hangzhou food, and ordered West Lake Fish in Vinegar Sauce and Fried Shrimps with Longjing Tea. When the waiter brought it up, I saw that the fish meat was fresh and tender, with a moderate sour and sweet taste, while the shrimp had a refreshing tea aroma, which really made my appetite boil. During the meal, I happened to see West Lake outside the window, and even the mood of eating became particularly beautiful. In the afternoon, I decided to climb the Leifeng Pagoda. From the top of the pagoda, I could see the entire West Lake in full view. The shocking feeling was indescribable in words. The distant mountains undulate, the nearby lake shimmers, and the surrounding tourists seem to have become embellishments in the painting. In the evening, I strolled in Hefang Street, where there were many snack stalls, and I tasted several kinds of snacks, especially a traditional Dim sum called Dingsheng Cake. It was soft, glutinous, sweet, and memorable. As I was walking, I also came across a handicraft shop where the owner enthusiastically introduced Hangzhou's silk culture. I bought a handmade embroidered scarf as a souvenir and felt that this trip was even more perfect. Today, I climbed the Leileilei Peak Tower, went to the Hangzhou food in the building outside the building, tasted local Hangzhou food, and went to the snack street to taste all kinds of Dim sum, especially Dingsheng Cake, which was just a few days' trip to Hangzhou, and let me experience the tenderness and charm of Jiangnan. Although I felt a bit reluctant when I left, I know this memory will always stay in my heart."
00086.wav,English,"Last summer I visited Boston for a short getaway. It was my first time in this in this city. And I was excited to his role in history and culture. I started my trip by walking the freedom trails, a path, a path that take me, take you through some of most historic side in the city, along the way, I saw a famous program, a rivers house and old North church. And I learned a lot about the American revolution. I also serve as final. How? Where I heard street performers playing Jazz music, the south of their its instrument mixed with the chatter of stories, created a lively atmosphere. The next day, I visited Harvard University in the nearby. Cambridge, walking through the campus. I felt a sense of inspiration. It was like stepping into a world where ideas and innovations through3. I spent some time in the Harvard Museum of Natural History, looking at habits of fossil and dinosaur skeletons. The museum was quiet, and the air inside smell like old wood and dust, which made it feel even more like a place of Discovery. In the evening, I had dinner as a small seafood restaurant by the harbor, enjoying a place of fresh lobster while watching the sunset all over the water. The city has a vibrant, red crown, calm energy. And it's made me realize how much there is to learn. And its parents in places with such deep history."
