filename,Language,text_english
00059.wav,Chinese,"I finally fulfilled my wish to travel to Japan during the summer vacation of my third year of junior high school. This trip has allowed me to experience a country that is both modern and full of traditional cultural atmosphere, and every day makes me feel excited and satisfied. On the first day, I came to Universal Studios in Osaka. This place was always on my list of plans. When I entered the Harry Potter area of the park, everyone was excited and jumped up. The magnificent Hogwarts Castle in the movie is now standing before my eyes, and the feeling is unbelievable. Walking on the path, I feel like I have truly entered a magical world, and even the surrounding air seems to have become magical. Then I went to Xiaohuangren, where there was a very interesting VR experience project. During the game, I felt like I was flying in the sky, shuttling through various scenes, but in reality, I was just sitting in place. This project allowed me to fully experience the charm of technology, which was both thrilling and fun. In the evening, I was very lucky to catch a flower drum festival, where fireworks bloomed in the night sky, colorful, accompanied by the music of fireworks, and the whole night seemed to be lit up. The beauty of fireworks makes me marvel, and the scenery of this moment will forever be imprinted in my memory. The next day, I arrived at Nara Park, a famous attraction with many small paths that were completely unafraid of people and even approached them voluntarily. I bought some deer fairy shells to feed them, and these cute little ones surrounded me gently nibbling on the food in their hands. Being able to have close contact with these animals made me feel the harmony between humans and nature, and also filled my day with warmth. Afterwards, I went to Mount Fuji and on the way to the foot of the mountain, we passed the famous music road. As the wheels rolled over the road, they actually played a beautiful melody. This wonderful design has opened my eyes. At the foot of Mount Fuji, I took a photo of Rosen Convenience Store framed with Mount Fuji, which was a particularly memorable moment of this trip. On the third day, I visited Osaka Castle Park and felt the weight of history. I also went to the palace where the emperor lived. On the last day, I arrived at Yokohama Chinatown and saw that traditional Chinese culture was also warmly welcomed in Japan. My heart was filled with pride and emotion. This trip to Japan has brought me many wonderful memories and made me look forward to my next trip even more. I hope to have the opportunity to go again and continue exploring this beautiful country."
00060.wav,English,"In 2022, I visited my great grandfather for the first time. He lived in a small, quiet village surrounded by green hills and fields. Despite being over 90 years old, he was still remarkably sharp and full of energy. I had heard many stories about him from my family, but meeting him in person feel like a connection to a new chapter of my heritage. As we sat in his living room, drinking tea, he had prepared. I asked him about my grandfather's childhood. His face lit up with a warm smile as he began to recall the past. Your grandfather was a naughty boy, he said, drinking the tea. But he had a heart of gold. I remember one time when he was about 7 years old, he tried to help me plant rice in the field instead of planting the seedlings in the right place, he scattered them all over the place. When I asked him what he was doing, he told me he wanted rice plants to be Free to grow wherever they liked. We both laughed at the photo of my young grandfather running around the field, completely unaware of the chores he was causing. My grief. Grandfather then told me about the time. When my grandfather saved a small dog, he found it shivering in the rain one day and brought it home, hiding it in his room. Because he thought I wouldn't let him keep it. When I discovered it, he begged me to let the dog stay. Promising. He would take care of it. I couldn't say no to his determination. Hearing these stories. I felt as though I was meeting a different version of my grandfather, one boy who was playful kind and full of dream. My great grandfather's eyes sparked as he spoke, his voice carrying the weight of love and pride. That day, I learn so much more than just a few stories. I gained a deeper understanding of my family's values and history. It was a visit that left lasting is impression on my heart. And I promised myself to cherish the story and wisdom passed down through generations."
00061.wav,English,"Last summer to visit my childhood home for the last time before it was sold. The house, which had always been a place of comfort and memories, was now empty. As I walked through the rooms, each space seemed to equal with the laughter and the events that had shaped my life. I stood in the living room, remembering the family dinners and gatherings that once filled it with warps, the familiar smell of old furniture, and the breaking of the floors, bought everything rushing back. The hardest part was going into my old bedroom. It looks so different now. Empty of all the things I had felt it with over the years. I walked to the wooden floorboard where as a child, I had covered my name with a small knife. I hadn't thought about it in years. But as I run my finger over the group, I felt a deep sense of nostalgia. It was like saying goodbye to a part of myself. Afterwards, I went out to the garden. It was there. I spent countless hours playing as a child, and I couldn't live without taking something with me. I picked up a small rock from the ground, a simple gesture, but it felt like taking a piece of the place with me. I split it into my pocket, knowing it would remind me of the house. One, I could no longer return. It was a deeply emotional day. As I locked the door behind me for the last time, I realized it was closing the chapter on an important part of my life. The house had shaped who I was and living. It felt like living behind a piece of my childhood. It wasn't just a house, but it was a memory. The people and the mountain that has made its form, saying goodbye was harder than I had imagined. But I know it was time to let go."
00062.wav,Chinese,"In October last year, I received a request from the company to go on a business trip to Hangzhou. The trip went very smoothly, so my work was completed ahead of schedule, giving me a free afternoon. So I decided to go to West Lake alone and enjoy the famous scenic spots and autumn scenery in Hangzhou. There, I met an old man who was taking photos, holding a large DSLR camera and shooting back and forth at West Lake. Later, he seemed to be a bit exhausted, so he asked me if he could get my help, so I helped him complete the final set of photos. We chatted for a while and learned that he is a retired local expert in cultural relic restoration. Therefore, he took the initiative to take me to visit some corners that are not often visited by tourists, and explained to me the historical traces and stories hidden in these unknown corners. He shared with me a lot of stories about West Lake. We watched the most beautiful sunset together by the Broken Bridge, and finally went to a small stall on the street to drink a cup of classic Longjing tea. Finally, we exchanged contact information. After this trip, I learned about some unknown stories from the past in Hangzhou. Witnessing Hangzhou, an ancient and beautiful city from another perspective, can be considered a pleasant and nostalgic encounter with Hangzhou and West Lake."
00063.wav,Chinese,"In the fourth grade of primary school, my father, my mother, and I went to climb Mount Taishan with one of his good friends. Well, I was very young at that time, but I didn't know how high Mount Taishan was and what difficulties I would encounter on the way, so I followed. But if I were now, I would probably not choose to climb the mountain. Because climbing mountains is really too tiring for me. Anyway, at that time, I was walking along the winding mountain road, and I was really exhausted and panting. But all of them kept saying, 'Just climb a little more and you'll reach the top.' Anyway, they were always deceived and climbed up. Well, while crawling, there were those people selling drinks and grilled sausages on the roadside. I can't remember if there were any grilled sausages left, anyway, they were just selling some expensive food. So it seems like we carried some water ourselves at that time, and I'm even more tired this week. However, the more interesting thing about climbing Mount Taishan is that the scenery on the road is not bad. Looking down from a high place, a large area is green, which really makes people feel good. Ah, but there's one more thing that left a deep impression on me when looking down from a high place. There was a small section where the steps were a bit too steep, and I was quite scared at the time. Anyway, I was sitting directly on that step, leaning back because I was afraid of falling. Well, overall, it was already evening when we climbed to the top, and we bought a thick cotton coat, but I think it was very dirty. At that time, I seemed to have stayed for a little night, preparing to wake up the next morning to watch the sunrise. I remember it was particularly cold at that time, and I didn't seem to see the sunrise. In my impression, it was all blocked by clouds. Uh huh. Well, it's interesting on the whole. I'm not so tired when I go down the mountain, but I'm a little afraid when I go down the mountain. I'm really afraid of falling down. Anyway, I talked and laughed all the way. Finally, Mount Taishan also fell down. Uh huh, uh huh."
00064.wav,English,"In the summer of early evening, I had the operational to visit San Francisco a city known for its culture and sunny national beauty. It was my first time in California and I was eager to explore everything the city had to offer. I arrived in San Francisco on a Sunday morning and the first thing that struck me was a unlock Golden Gate bird, a towering over the bed with is orange and color. I decided to start my trip by taking a walk across the bridge. The wind has a brisk, but the view had was breathtaking. I as I walked, I could see the vividic against the panel of the bridge and the city scale scale scale line sketching out behind me. After crossing the bridge I made I made my way to Free fisherman was far one of the most popular tourists. Sports in in the city. The air was flushing with activity, filling with streets, performers, visitors, selling fresh, uh, seafood and tourists from all over the world. I spotted at a small in Thailand restaurant called for lunch, the meal was full of traditional Thailand dishes. And I decided to try the homemade pizza with a side of garlic bread. The food was delicious. I and the warm inviting atmosphere of the restaurant made me feel right at home. Want the journey to San Francisco not only allow me to express the city rich history and diverse culture, but also give me a deeper appreciate for the beauty and warmth of the people I meet along the way despite the sport. During of my visiting it left a a inside blind Mark on my heart. And I look forward to the day when I uh, when I can return, I explore more of the city."
00065.wav,English,"Last summer I visited a small island with my friends. And it turned out to be one of the most exciting trips i've ever had. The island was known for its crystal, clear waters, and vibrant coral reefs. But what exactly caught our attention was a cliff jumping spots that locals recommended. I've always been a little afraid of heights, but my friends insisted it would be an unforgettable experience. We've arrived. This place, this place was even more stunning than I had imagined. The cliffs rose high about the tower water. And you could even see those small balls up in the distance. The air was warm. And the sound of waves crashing against the rocks added to the excitement. A group of locals was already there, you know, cheering and diving gracefully into the sea below. At first, I hesitate, standing at the edge of the cliff, filled my legs for shaking, you know, the height looked much greater than I had imagined. And the sound of jumping was terrifying. But my friends encouraged telling me that I'd regret if I didn't try. One of them even went first yelling with joy as this flashed into the water. There is segment was so crazy, you know. And I finally decided to go for it. I close my eyes and took a deep breath. Die jumped. The moment I felt age, my fear turned into pure, exciting. The wind rushed past me. And for a few seconds, you feel like I was flying. I hate water. It was cold. Sexy. And I surfaced to the sound of cheers from my friends. I couldn't stop laughing. I feel so alive. So Free. And after that first job, I couldn't get enough. We spent the rest of the afternoon taking turns diving into the water, and exploring the nearby local roofs. By the time the sun began to sight, the cliffs were better in golden light. And we all agreed. It was one of the most best days of our lives."
00066.wav,Chinese,"Last holiday, I went on a trip to Saipan Island, which was indeed a place that left people reluctant to leave. For this trip to Saipan Island, we did a lot of homework in advance. The activities on Saipan Island were very diverse, and what attracted me the most were diving and jungle exploration. On the first day, we arrived at Warship Island and I signed up for a snorkeling trip. First, we arrived on the island by speedboat, changed into snorkeling equipment, and followed the diving instructor to dive into the water. The underwater world is truly awe inspiring. Various colorful fish shuttle through the coral reefs, and the tour guide even took us to a place where turtles gather. We saw turtles swimming gracefully in the water, which were scenes I had never seen before. The next day, I went on an adventure in the jungle. The tropical rainforest of Saipan Island was full of mystery. My leader and I chose a blue cave route, which passed through dense forests. Along the way, we could see many local plants and birds. As we advanced on this route, we stood at the edge of the cliff overlooking the natural caves formed by the impact of seawater on the rocks. The blue seawater shone with a charming light in the sunlight, which was truly amazing. Another thing not to miss on Saipan Island is its cuisine, with many dishes that blend local American flavors. I really like the local coconut crab, and the restaurant owner even taught us how to eat this large crab correctly. The crab has tender and juicy meat, and when paired with local dipping sauce, it has a unique flavor. On the last day, I also experienced the famous sunset on Saipan Island. Arriving at the highest point of the island, Bird Island Observation Deck, I waited for the sun to set in the west, sitting on the edge of the cliff watching the sun slowly fall to the horizon. My heart was filled with tranquility and satisfaction. This trip to Saipan Island allowed me to appreciate the beauty of nature and the rich cultural experiences. I was a little reluctant to leave him, hoping that I would have another chance to come to this beautiful island."
00067.wav,Chinese,"It was a sunny weekend, and I decided to visit my good friend Li Ming. He lives on the other side of the city, which is a place I rarely go to. We haven't seen each other for several months, so this visit was of great significance to me. I planned the route a day in advance to ensure that I didn't miss any important transportation information. In the morning, I put on my favorite blue shirt and brought some homemade cookies as gifts, which are all Li Ming's favorite. Before going out, I checked the weather forecast to make sure that I would not encounter a sudden rainstorm. When I took the subway, I shuttled in the city context, hearing the whispers of people in the car and the roar of the train. Well, my mood is both excited and nervous, imagining the scene of our reunion, the subway passing through the tunnel, the sunlight shining through the window on my face, warm and comfortable. Finally, I arrived at my destination. As I walked past the subway station, it was a winding path lined with lush trees. Walking along the path, I felt the gentle breeze brushing my face and the fragrance of flowers in the distance. My mood also relaxed. Li Ming's home is a cozy little villa with a small garden in front of it. It carefully takes care of the flowers inside. I rang the doorbell, and soon the door opened. Li Ming's smile caught my eye, and we hugged each other. She took the cookies from my hand and thanked us repeatedly for sitting on the sofa in the living room and chatting about our recent situations. Li Ming told me that he has recently started learning horticulture and showed me several new plants he has planted. I shared some of the twists and turns and challenges in my work and studies. Ah, our topic jumps from memories of the past to planning for the future, and time seems to stop at this moment. During our lunch break, we tasted the noodles made by Li Ming himself, paired with the cookies I brought, and the taste was unexpectedly good. Let's take a walk together in the garden in the afternoon, discussing the growth habits of various plants. As the sun sets, I bid farewell to dawn and embarked on the road home. Although my body was a bit tired, my heart was filled with warmth and satisfaction. This visit not only allowed me to relive old friendships, but also allowed me to experience a pleasant city adventure. On the subway back home, I was already looking forward to the next encounter."
00068.wav,Chinese,"Last semester, our school, Peking University, held the President's Cup football competition, which was a competition between college teams. As the team captain of the International College of Beijing University of Posts and Telecommunications, I led the team to win the championship by defeating opponents all the way. The most impressive game for me was the final. At the beginning of the game, due to a defensive mistake, we were first scored by the opponent. Later, because there was someone on the other side who felt like he was passing the ball, he made a mistake and dropped it straight up and down towards the goal. The goalkeeper also made a judgment mistake and did not judge the distance to clear the ball, so it fell into the goal. In the first 20 minutes of the game, we conceded two goals, and everyone's morale was relatively low. As the team captain, I shout and encourage my teammates to be more proactive, telling them that it's not a big deal. Our strength is stronger than theirs, so there's no need to be afraid. So towards the end of the first half, we got a corner kick, and I made a corner kick that turned directly towards the goal. Although there were some lucky reasons, we turned towards the goal and ended the first half with a score of 2:1. Then in the second half, we became more and more brave, and because our overall strength was stronger, and we caught up with a ball, it was like blowing the horn of counterattack. In the second half, we first committed a foul on the other side and received a penalty kick. Then, in a melee, we were in the middle of our boat and scored an own goal on the other side. In the end, I passed two people on the flank and then took a cut shot into the corner. Ah, I am very excited. Although it has been six months, I still remember it vividly yesterday. In the end, we defeated our opponents 4-2 and won the Principal's Cup championship. This is also my second championship after winning the high school class competition. And as the captain, I feel very, very happy. I participated in the entire game and made a very, very great contribution to the team. Then our State Council also showed a very united side. In the end, we defeated other opponents and overcame all obstacles along the way, passing the test without losing a single game, and won the championship with a perfect record."
00069.wav,English,"As I stepped into the old bookshop, the scent of age, paper and laser building, enveloped me like a worm hog. I have visited this place countless times as a child, often dragging my mother alone, lost in the world of stories. Today I was returning alone, searching for a piece of my past. The shopkeeper MR. Wang was still there. His silver hair and gentle smile unchanged. He looks up from behind the counter. His eyes lighting up. Ah, I remember you. You used to call me with your mother. Always looking for adventure stories. I nailed it a wave. Just floating over me. I'm looking for something special today. I said, my voice trembling, slightly. Sunshine. To remind me about her. Mister wang expression softened. He guided me to the corner filled with forgotten tales. As we browsed, he shares stories about each book's journey. I feel bittersweet, joy, remembering my mother's laughter. As he read to me, it is very sharp. Finally, I found it worn copy of the adventure of Tom Sawyer. It was the last book she read to me before she passed away. Tears brimmed in my eyes as I held it to close as I held it close. Thank you, mister. Wang, I whispered. He smiled knowingly. Books have a way of keeping memories alive as alive as I left. The weight of sadness lifted slightly, replaced by worms of cherished memories. I knew I would return carrying part of her with me."
00070.wav,English,"Back in 2021 my family and I went to Sanya. As soon as I arrived as a hotel, I couldn't wait to rush to the seaside, because our hotel was beside the beach. So I can quickly run to the seaside in my swimming tracks, looking at the sparking sea. I couldn't help shouting. I'm coming with excitement. I jumped into the water, fill in the cool sea water, and bathing in the sunshine. My stress was released instantly after swimming in the sea for a while. I saw someone playing c moto nearby, watching them, driving one by one on the sea. Byebye. And it raise my interest. Nana. With a nervous and excited feeling. I got on the jet under the gardens of the staff. After several attempts, I gradually found the rest of my skills. Then I started to let myself go and drove at full speed on the sea. When I was having a good time, I accidentally overturned the motto and fell into the sea. The cold water woke me up. And under the guidance of my Coach, I drove slowly back to the shore. But this little accident didn't affect my happy mood at all. I was really happy during this trip to Sanya. And the I want to back to Sanya more time. Nasa."
00071.wav,English,"In 2017, I visited Paris. It was a city I had always wanted to see. I arrived early in in the morning at the airport and went straight to my hotel near have the tour. I was so excited that I decided to start exploring right way. The first place I went to was the exile tower. It was still morning. So there were not too many people. I took my time to look at this one uh, from the ground before taking the I will later up when I reach the Top, the view was amazing. I could see the whole city with the seen the river and all beauty streets. I stayed there for a long time, just looking at everything and feeling so happy to be in Paris. The sun was shining and is felt like a dream come true. After visiting the Eiffel Tower, I walked to the lower museum. The museum is huge and I knew I would not be able to see everything in one day. So I choose a few famous PCs to c the Mona Lisa was much smaller than x it. But I was still so special to see it in real life. I also loved in the victory. And other things, walking through the museum feels like I was traveling back in time, surrounded by so many beautiful and old things."
00072.wav,English,"It was it was a time I back to a to shows and14 and it has been years since we came altogether with my family, we go to uh renew and ask the lakeside cabin. And I remember the lake was surrounded by towering pines. We have been years to reunion together. I felt a mixture of joy and anxiety in the air. But we still connected, as we once did. It's the sun dipped by the horizon, cast in the golden hue over the lake. We share stories and memories around the fire. My cousin, Sarah os. Joke teller, had everyone in the search with her impressions. I felt the worms of billowing wash over me. Laughter echoing into the night, yet missed the drawer. I noticed my uncle sitting quietly on the edge of the dock, staring into the water. He had lost his wife a year ago. And though she's he smiled at times, the sadness in his eyes was palpable. Ok. I felt a pound of sorrow for him, knowing how difficult was to navigate the leaves of grief, gathering my courage. I walked over and sat behind him. He yang Cosme. Want to talk? I asked gently, he looked at me, surprise, flicking in his eyes. We spoke about Sunday may sharing stories that made a smile and cry. In that moment, I felt a connection deeper. The annual laughter shared around life, love and loss. It was a reminder the family bonds can heal if the most profound wounds."
